[
  {
    "id": "roman-vs-fatu-whc",
    "name": "Roman Reigns vs Jacob Fatu (WHC)",
    "type": "feud",
    "opened_at": "smackdown-2026-04-25",
    "carriers": [
      "roman-reigns",
      "jacob-fatu"
    ],
    "register": "Pantheon",
    "promised_payoff": "ppv-match",
    "promised_payoff_show": "backlash-2026-05-09",
    "notes": "Aitu vs Patriarch \u2014 worldview clash, not faction war. Fatu declared for Raw on SD 4/25; physical arrival Raw 4/27."
  },
  {
    "id": "bron-vs-seth-2026",
    "name": "Bron Breakker vs Seth Rollins (2026 arc)",
    "type": "feud",
    "opened_at": "wrestlemania-42-n1-2026-04-18",
    "carriers": [
      "bron-breakker",
      "seth-rollins"
    ],
    "register": "Pantheon",
    "promised_payoff": "ppv-match",
    "promised_payoff_show": "backlash-2026-05-09",
    "notes": "Bound-Loki founding the next devourer. WM42 was unearned; Backlash is the on-the-level handoff."
  },
  {
    "id": "cody-vs-gunther-2026",
    "name": "Cody Rhodes vs Gunther (2026)",
    "type": "feud",
    "opened_at": "smackdown-2026-05-01",
    "opened_by_segment": "smackdown-2026-05-01-seg-12",
    "carriers": [
      "cody-rhodes",
      "gunther"
    ],
    "register": "Pantheon",
    "promised_payoff": "ppv-match",
    "promised_payoff_show": "clash-italy-2026-05-31",
    "notes": "Sleeper attack post-Cody/Saints SD 5/01 opened. Heyman segment SD 5/08 escalated \u2014 4 sleeper attempts, Gunther embarrassed on go-home. Match did NOT happen at Backlash; rescheduled to Clash in Italy 5/31 Turin (Riyadh Season-sponsored). SD 5/15: Cody set up contract himself (one-man-crew); Keys interrupted; Aldis booked Keys vs Gunther as #1 contender match. Gunther beat Keys; Cody Cross-Rhodes on Gunther post-match."
  },
  {
    "id": "asuka-vs-iyo-backlash",
    "name": "Asuka vs IYO Sky (Backlash)",
    "type": "feud",
    "opened_at": "raw-2026-04-27",
    "opened_by_segment": "raw-2026-04-27-seg-10",
    "carriers": [
      "asuka",
      "iyo-sky"
    ],
    "register": "Pantheon",
    "promised_payoff": "ppv-match",
    "promised_payoff_show": "backlash-2026-05-09",
    "notes": "Senpai/kohai bond severance. Bombthrower-coded after S12 mist Raw 5/04."
  },
  {
    "id": "trick-vs-sami-backlash",
    "name": "Trick Williams vs Sami Zayn (Backlash)",
    "type": "feud",
    "opened_at": "smackdown-2026-04-25",
    "opened_by_segment": "smackdown-2026-04-25-seg-08",
    "carriers": [
      "trick-williams",
      "sami-zayn",
      "lil-yachty"
    ],
    "register": "Pantheon",
    "promised_payoff": "ppv-match",
    "promised_payoff_show": "backlash-2026-05-09",
    "notes": "Sami descent \u2192 gingerbread ambush \u2192 funeral \u2192 blindside. Successor vs predecessor."
  },
  {
    "id": "danhausen-vs-miz-wilson",
    "name": "Danhausen + mystery partner vs Miz & Kit Wilson (Backlash)",
    "type": "feud",
    "opened_at": "smackdown-2026-04-25",
    "opened_by_segment": "smackdown-2026-04-25-seg-11",
    "carriers": [
      "danhausen",
      "the-miz",
      "kit-wilson"
    ],
    "register": "Constant",
    "promised_payoff": "ppv-match",
    "promised_payoff_show": "backlash-2026-05-09",
    "notes": "Sacred Clown vs Hollywood-heel pipeline. Mystery partner reveal at Backlash; CM Punk -200 odds."
  },
  {
    "id": "tongan-death-grip-taboo",
    "name": "Tongan Death Grip code-violation taboo",
    "type": "meta",
    "opened_at": "raw-2026-04-27",
    "opened_by_segment": "raw-2026-04-27-seg-12",
    "carriers": [
      "jacob-fatu",
      "roman-reigns",
      "jimmy-uso",
      "jey-uso"
    ],
    "register": "Pantheon",
    "promised_payoff": "undefined",
    "notes": "Sacred-family-move violation. First applied Raw 4/27 closer. Consecrated on-air Raw 5/04 (S15) then re-violated."
  },
  {
    "id": "bloodline-civil-war",
    "name": "Bloodline civil war (MFTs vs Usos vs Reigns)",
    "type": "faction",
    "opened_at": "summerslam-2025",
    "carriers": [
      "roman-reigns",
      "jacob-fatu",
      "solo-sikoa",
      "jimmy-uso",
      "jey-uso",
      "tama-tonga",
      "talla-tonga"
    ],
    "register": "Pantheon",
    "promised_payoff": "undefined",
    "notes": "Multi-vector household fracture. Three factions claim variations of the name."
  },
  {
    "id": "mfts-collapse",
    "name": "MFTs faction collapse + remnant restructure",
    "type": "faction",
    "opened_at": "smackdown-2026-04-25",
    "carriers": [
      "solo-sikoa",
      "tama-tonga",
      "talla-tonga",
      "jacob-fatu"
    ],
    "register": "Constant",
    "promised_payoff": "undefined",
    "notes": "Tama coup \u2192 Fatu superkick \u2192 Fatu beats Solo clean. SD 5/08: Solo demoted to manager-architect; remnant hierarchy functions."
  },
  {
    "id": "vision-faction",
    "name": "The Vision (Logan / Theory / Bron / Heyman)",
    "type": "faction",
    "opened_at": "wrestlemania-42-n1-2026-04-18",
    "carriers": [
      "logan-paul",
      "austin-theory",
      "bron-breakker",
      "paul-heyman"
    ],
    "register": "Pantheon",
    "promised_payoff": "undefined",
    "notes": "Operative class. Heyman + Bron the leash question; Logan + Theory the payoff line. SD 5/08 reframed \u2014 Heyman not Vision-locked."
  },
  {
    "id": "jd-coven",
    "name": "Judgment Day women's coven",
    "type": "faction",
    "opened_at": "raw-2026-04-20",
    "carriers": [
      "liv-morgan",
      "roxanne-perez",
      "raquel-rodriguez"
    ],
    "register": "Constant",
    "promised_payoff": "undefined",
    "notes": "Liv as queen, Roxanne as apprentice, Raquel as enforcer. Operating with McDonagh + Dom on the men's side."
  },
  {
    "id": "fatal-influence-arc",
    "name": "Fatal Influence (Jacy + Fallon + Lainey) main-roster arc",
    "type": "faction",
    "opened_at": "smackdown-2026-04-25",
    "opened_by_segment": "smackdown-2026-04-25-seg-06",
    "carriers": [
      "jacy-jayne",
      "fallon-henley",
      "lainey-reid"
    ],
    "register": "Constant",
    "promised_payoff": "undefined",
    "notes": "NXT call-ups debut SD 4/25 (2 DQs); SD 5/01 first dirty win (Jacy over Charlotte); SD 5/08 main-event win via Jade interference."
  },
  {
    "id": "irresistible-forces-arc",
    "name": "Irresistible Forces (Nia + Lash) post-WM42 chase",
    "type": "faction",
    "opened_at": "wrestlemania-42-n1-2026-04-18",
    "carriers": [
      "nia-jax",
      "lash-legend"
    ],
    "register": "Constant",
    "promised_payoff": "undefined",
    "notes": "Lost titles WM42 + rematch SD 5/01. Returned SD 5/08 to challenge Paige + Brie; Rhea cut their exit."
  },
  {
    "id": "jade-faction-debut",
    "name": "Jade + Michin + B-Fab faction debut (unnamed)",
    "type": "faction",
    "opened_at": "smackdown-2026-05-08",
    "opened_by_segment": "smackdown-2026-05-08-seg-14",
    "carriers": [
      "jade-cargill",
      "michin",
      "b-fab"
    ],
    "register": "Pantheon",
    "promised_payoff": "undefined",
    "notes": "Formal naming deferred. Jade approached Alexa post-debut \u2014 recruitment or warning open."
  },
  {
    "id": "hendry-orphic-bard",
    "name": "Joe Hendry \u2014 Orphic Bard ascent",
    "type": "arc",
    "opened_at": "raw-2026-04-13",
    "carriers": [
      "joe-hendry"
    ],
    "register": "Liminal-Warrior",
    "promised_payoff": "undefined",
    "notes": "Concert mechanic. 4/27 Laredo (75% singalong, border crowd) \u2192 5/04 Omaha (full singalong, mat-credibility crowd)."
  },
  {
    "id": "oba-ascension-streak",
    "name": "Oba Femi \u2014 Ascending Orisha (credential streak)",
    "type": "arc",
    "opened_at": "wrestlemania-42-n2-2026-04-19",
    "carriers": [
      "oba-femi"
    ],
    "register": "Pantheon",
    "promised_payoff": "undefined",
    "notes": "Streak isn't wins \u2014 it's a stack of impossible feats. WM42 (Lesnar/Surtr), Raw 4/27 (Waller squash + open challenge), Raw 5/04 (Otis-mass powerbomb)."
  },
  {
    "id": "rollins-lone-wolf-arc",
    "name": "Seth Rollins \u2014 Bound-Loki preparing the handoff",
    "type": "arc",
    "opened_at": "wrestlemania-42-n1-2026-04-18",
    "carriers": [
      "seth-rollins"
    ],
    "register": "Pantheon",
    "promised_payoff": "ppv-match",
    "promised_payoff_show": "backlash-2026-05-09",
    "notes": "Must lose to Bron *alone* \u2014 coalition would dilute the handoff. Refused alliance Raw 5/04 S11."
  },
  {
    "id": "balor-fomorian-exile",
    "name": "Finn B\u00e1lor \u2014 Fomorian-Exile / Club House",
    "type": "arc",
    "opened_at": "raw-2026-04-06",
    "carriers": [
      "finn-balor"
    ],
    "register": "Constant",
    "promised_payoff": "undefined",
    "notes": "Ejected from JD; hosting 'Club House'. Two losses to McDonagh in two weeks (won 4/27 dossier loss, lost 5/04 dirty)."
  },
  {
    "id": "becky-nemesis-arc",
    "name": "Becky Lynch \u2014 Nemesis (post-WM42 victory tour)",
    "type": "arc",
    "opened_at": "wrestlemania-42-n1-2026-04-18",
    "carriers": [
      "becky-lynch"
    ],
    "register": "Pantheon",
    "promised_payoff": "undefined",
    "notes": "Controlled IYO sequence Raw 4/27. Made mortal Raw 5/04 (Sol Ruca Sol Snatcher)."
  },
  {
    "id": "asuka-onryo-register",
    "name": "Asuka \u2014 Onry\u014d register expansion (post-WM42)",
    "type": "arc",
    "opened_at": "wrestlemania-42-n2-2026-04-19",
    "carriers": [
      "asuka"
    ],
    "register": "Pantheon",
    "promised_payoff": "undefined",
    "notes": "Three-layer stack: Yamauba authority + Hannya wound + Onry\u014d weapon. Expanded Raw 5/04 with senpai-authority + 'wakatta?'."
  },
  {
    "id": "sol-ruca-vs-becky-program",
    "name": "Sol Ruca vs Becky Lynch (Women's IC track)",
    "type": "feud",
    "opened_at": "raw-2026-05-04",
    "opened_by_segment": "raw-2026-05-04-seg-05",
    "carriers": [
      "sol-ruca",
      "becky-lynch"
    ],
    "register": "Liminal-Warrior",
    "promised_payoff": "undefined",